{
  "$schema": "../schemas/environment.schema.json",
  "name": "test",
  "kind": "lifetime",
  "enabled": false,
  "description": "Enterprise Test/QA environment. Set baseUrl and lifetimeEnvironmentName, then enabled=true.",
  "baseUrl": "https://test-REPLACE_ME.outsystemsenterprise.com",
  "lifetimeEnvironmentName": "Test",
  "siteProperties": {
    "HighAvailabilityMinPct": 50,
    "LowAvailabilityMaxPct": 20,
    "StaleAfterMinutes": 15,
    "ReadingOutdatedMinutes": 60,
    "CacheTtlSeconds": 60,
    "MinRefreshIntervalSeconds": 15,
    "CarparkInfoMaxAgeHours": 24,
    "HdbCarparkInfoResourceId": "d_23f946fa557947f93a8043bbef41dd09"
  },
  "secrets": {
    "DataGovApiKey": { "fromEnv": "CARPARK_DATAGOV_API_KEY", "required": false }
  },
  "checks": {
    "minCarparks": 1500,
    "requireLocationData": true,
    "maxDataAgeMinutes": 15
  }
}
